機構名稱,Longitude,Latitude,Address,Area,St
文昌春天藥局,121.5215528,25.0956225,臺北市士林區文昌路44號(實際使用:1樓),士林區,文昌路
三原藥局,121.5094074,25.08589867,臺北市士林區延平北路五段293號(實際使用:1樓),士林區,延平北路
新興藥局,121.5206205,25.10397683,臺北市士林區德行西路１１７號,士林區,德行西路
坤成泰藥局,121.5161723,25.08995552,臺北市士林區大南路４１２號,士林區,大南路
杏城藥局,121.532249,25.11763699,臺北市士林區天母東路２４號,士林區,天母東路
文祥藥局,121.5420468,25.13749085,臺北市士林區光華路２６巷２弄２號,士林區,光華路
建芳藥局,121.5295563,25.10803806,臺北市士林區德行東路１４８號,士林區,德行東路
慈航藥局,121.5245687,25.09480732,臺北市士林區文林路４４１號,士林區,文林路
宏大藥局,121.5071813,25.08786675,臺北市士林區社子街63巷9弄2-1號,士林區,社子街
詹有田藥局,121.5234308,25.08972079,臺北市士林區大南路１２７號,士林區,大南路
博惠藥局,121.5236017,25.09548634,臺北市士林區華榮街１６號,士林區,華榮街
有德堂大藥局,121.5251151,25.10888445,臺北市士林區中山北路六段２２７號,士林區,中山北路
安寧藥局,121.5199092,25.0828459,臺北市士林區劍潭路91號,士林區,劍潭路
博泰藥局,121.5038113,25.09222541,臺北市士林區社中街３６７號,士林區,社中街
華倫藥局,121.5055151,25.09151994,臺北市士林區永平街８０巷１０號１樓,士林區,永平街
詠恩藥局,121.5095752,25.08619268,臺北市士林區延平北路五段316號1樓,士林區,延平北路
仁大藥局,121.5083331,25.08769049,臺北市士林區社子街13號1樓,士林區,社子街
三光藥局,121.5095485,25.08627942,臺北市士林區延平北路五段320號1樓,士林區,延平北路
社正藥局,121.5092776,25.0885376,臺北市士林區社正路12號,士林區,社正路
南風藥局,121.5233312,25.09715587,臺北市士林區美崙街19號1樓,士林區,美崙街
菁安藥局,121.5234559,25.0971747,臺北市士林區美崙街13號1樓,士林區,美崙街
景正藥師中西藥局,121.5178302,25.08753114,臺北市士林區福港街１５２號,士林區,福港街
佳赫藥局,121.5213792,25.09604928,臺北市士林區文昌路62號,士林區,文昌路
勝泰藥局,121.5211514,25.10275837,臺北市士林區文林路７１４巷１１號,士林區,文林路
士林三安藥局,121.5260087,25.08898084,臺北市士林區大南路１１號,士林區,大南路
?宏藥局,121.5256281,25.09145851,臺北市士林區大東路９０之１號,士林區,大東路
太安藥局,121.5101302,25.08251182,臺北市士林區延平北路五段157號,士林區,延平北路
田倉藥局,121.5301581,25.11219332,臺北市士林區士東路124號,士林區,士東路
日康藥局,121.5267369,25.11167788,臺北市士林區士東路１２號１樓,士林區,士東路
環安藥局,121.5205355,25.08860095,臺北市士林區大南路２４４號１樓,士林區,大南路
正陽藥局,121.5194293,25.08266817,臺北市士林區華齡街１１號１樓,士林區,華齡街
加赫藥局,121.5212148,25.09646283,臺北市士林區文昌路76號,士林區,文昌路
麗森藥局,121.5269353,25.11854332,臺北市士林區天母西路51號,士林區,天母西路
天母大和藥師藥局,121.5316648,25.10896733,臺北市士林區德行東路189之1號１樓,士林區,德行東路
陽明藥局,121.5468874,25.13797206,臺北市士林區菁山路十號一樓,士林區,菁山路
康鈺藥局,121.5292096,25.10808845,臺北市士林區德行東路133號1樓,士林區,德行東路
今欣藥局,121.5273756,25.11931282,臺北市士林區天母西路41巷9號1樓,士林區,天母西路
資生堂藥局,121.5220223,25.08107202,臺北市士林區承德路四段40巷17號1樓,士林區,承德路
社子全民藥局,121.5105655,25.0816936,臺北市士林區延平北路五段120號,士林區,延平北路
康華藥局,121.5310729,25.1186355,臺北市士林區中山北路七段14巷二號二樓,士林區,中山北路
安泰藥師藥局,121.5086657,25.08843671,臺北市士林區延平北路六段83號(實際使用：1、2樓),士林區,延平北路
家赫藥局,121.5317167,25.10614065,臺北市士林區忠義街80號1樓,士林區,忠義街
得安藥局,121.5266601,25.08877558,臺北市士林區文林路140號,士林區,文林路
達揚藥局,121.5099011,25.08877112,臺北市士林區社正路36號1樓,士林區,社正路
和樹藥局,121.5227724,25.08443801,臺北市士林區後港街45巷1號1樓,士林區,後港街
博信藥局,121.5087636,25.08787771,臺北市士林區延平北路六段61號,士林區,延平北路
芳圓藥局,121.5079664,25.08749539,臺北市士林區社子街26之1號,士林區,社子街
柏雅大藥局,121.5226853,25.10505772,臺北市士林區德行西路64號,士林區,德行西路
麗登藥局,121.5266532,25.09108108,臺北市士林區文林路261號,士林區,文林路
信光藥局,121.5213576,25.09619424,臺北市士林區文昌路68號,士林區,文昌路
文昌大藥局,121.5212651,25.09634087,臺北市士林區文昌路72號,士林區,文昌路
幸福藥局,121.5283942,25.10812067,臺北市士林區德行東路109巷8號,士林區,德行東路
天爵藥局,121.5276386,25.11424669,臺北市士林區中山北路6段450巷1號,士林區,中山北路
石川藥師藥局,121.53142,25.1059435,臺北市士林區忠義街70號,士林區,忠義街
誼安藥局,121.5214694,25.08044249,臺北市士林區通河街42號,士林區,通河街
聖賢藥局,121.5200325,25.09056437,臺北市士林區士商路58號,士林區,士商路
美麗田藥局,121.520436,25.08090076,臺北市士林區通河街78號,士林區,通河街
大東健保藥局,121.5256719,25.09131395,臺北市士林區大東路86之4號,士林區,大東路
健揚藥局,121.509683,25.08482656,臺北市士林區延平北路五段251號,士林區,延平北路
光榮藥局,121.5103454,25.08990134,臺北市士林區社中街118號,士林區,社中街
天母康甯健保藥局,121.5245315,25.10890703,臺北市士林區克強路8號,士林區,克強路
大南春天生活藥局,121.5262341,25.08891303,臺北市士林區大南路317、319號,士林區,大南路
和謙藥局,121.5040515,25.09242095,臺北市士林區社中街362號,士林區,社中街
躍獅忠誠藥局,121.53142,25.1059435,臺北市士林區忠義街70號,士林區,忠義街
祥新藥局,121.5067454,25.08751342,臺北市士林區社子街65號,士林區,社子街
天母台安藥局,121.5262169,25.11834825,臺北市士林區天母西路34號,士林區,天母西路
華齡春天生活藥局,121.5199795,25.08686655,臺北市士林區華齡街36、38號,士林區,華齡街
德行春天生活藥局,121.5274641,25.10730213,臺北市士林區德行東路76號,士林區,德行東路
家安健保藥局,121.5287782,25.11156217,臺北市士林區德行東路109巷119號,士林區,德行東路
後港五代全民藥局,121.5191837,25.08278827,臺北市士林區和豐街6號,士林區,和豐街
德行盛康藥局,121.531987,25.1088979,臺北市士林區德行東路206之1號,士林區,德行東路
康佑藥局,121.5102874,25.08299467,臺北市士林區延平北路五段176號,士林區,延平北路
愛佳藥局,121.5214727,25.08850168,臺北市士林區承德路四段222之1號,士林區,承德路
安奕藥局,121.5099306,25.08033752,臺北市士林區葫蘆街30巷12號,士林區,葫蘆街
全予藥局,121.5328853,25.109385,臺北市士林區德行東路221號,士林區,德行東路
前港盛康藥局,121.5220502,25.08459856,臺北市士林區前港街28號,士林區,前港街
藥本家藥局,121.5327738,25.11884507,臺北市士林區中山北路七段14巷26號,士林區,中山北路
天母盛康藥局,121.5304328,25.11483515,臺北市士林區天母東路8巷84號,士林區,天母東路
中山盛康藥局,121.53271,25.12416526,臺北市士林區中山北路七段162號,士林區,中山北路
士東台安藥局,121.5287736,25.11182471,臺北市士林區士東路86之2號(實際使用:1樓),士林區,士東路
太和堂中西藥局,121.5256787,25.09036595,臺北市士林區大東路74號(實際使用:1樓),士林區,大東路
佩佩藥局,121.5252009,25.10758681,臺北市士林區中山北路六段182號,士林區,中山北路
容育藥局,121.5092705,25.08712116,臺北市士林區延平北路六段8號(實際使用:1樓),士林區,延平北路
石牌日春藥局,121.511331,25.11202629,臺北市北投區自強街５巷１０７號,北投區,自強街
聯合藥局,121.5099133,25.11293027,臺北市北投區石牌路一段二十三號,北投區,石牌路
玉山藥局,121.5025004,25.13453553,臺北市北投區光明路一四五號,北投區,光明路
實踐藥局,121.5077208,25.11487273,臺北市北投區實踐街十三號,北投區,實踐街
祐民藥局,121.5014498,25.13222042,臺北市北投區中央南路一段二○九號一樓,北投區,中央南路
妮妮藥局,121.5013713,25.1288423,臺北市北投區中央南路一段187號,北投區,中央南路
明正藥局,121.5014754,25.14002974,臺北市北投區永興路二段19號,北投區,永興路
天蓮藥局,121.5155151,25.11191768,臺北市北投區石牌路一段１６６巷１１５號,北投區,石牌路
丸三大藥局,121.5152668,25.11085944,臺北市北投區自強街１０５號,北投區,自強街
川秀藥局,121.516637,25.11792147,臺北市北投區石牌路二段九九巷九號一樓,北投區,石牌路
福恭藥局,121.4989527,25.12836283,臺北市北投區大業路３００巷１９號,北投區,大業路
建民藥局,121.5026708,25.13538049,臺北市北投區光明路161號,北投區,光明路
昌源藥局,121.4692331,25.12842617,臺北市北投區中央北路四段４８５號,北投區,中央北路
益元藥局,121.5013167,25.13309349,臺北市北投區光明路１０６號,北投區,光明路
元誠藥局,121.5013189,25.13934252,臺北市北投區中和街２１９－１號,北投區,中和街
九福藥局,121.508068,25.12612469,臺北市北投區公館路２３６號,北投區,公館路
弘安藥局,121.5193377,25.11218841,臺北市北投區懷德街３３號１樓,北投區,懷德街
黎明藥局,121.5065625,25.11817333,臺北市北投區尊賢街２５３之１號,北投區,尊賢街
明華藥局,121.5014643,25.13156546,臺北市北投區清江路8號(實際使用:1樓),北投區,清江路
美康藥局,121.5196068,25.10939934,臺北市北投區明德路９０號１樓,北投區,明德路
良興藥局,121.5003904,25.14046594,臺北市北投區中和街286號,北投區,中和街
康揚藥局,121.4997625,25.14108016,臺北市北投區中和街322號,北投區,中和街
嘉禾大藥局,121.5007172,25.14013956,臺北市北投區中和街二六四號,北投區,中和街
祐鄰藥局,121.5072858,25.11707035,臺北市北投區尊賢街二五○號,北投區,尊賢街
小明藥局,121.5013678,25.1314467,臺北市北投區中央南路一段六九號二樓,北投區,中央南路
上頤藥局,121.4996709,25.14097008,臺北市北投區中和街327號1樓,北投區,中和街
國泰藥師藥局,121.5160644,25.11120498,臺北市北投區自強街139-1號,北投區,自強街
長宜藥局,121.5154587,25.1107455,臺北市北投區自強街112號,北投區,自強街
康賢藥局,121.5153536,25.11422922,臺北市北投區西安街一段359號,北投區,西安街
大家藥局,121.5032945,25.13566318,臺北市北投區光明路182號,北投區,光明路
維康藥局,121.5155751,25.11600902,臺北市北投區石牌路2段191.193號,北投區,石牌路
杏嘉藥局,121.5017036,25.13044328,臺北市北投區清江路68號,北投區,清江路
大田大藥局,121.5163366,25.11632934,臺北市北投區石牌路2段68巷4號,北投區,石牌路
小豬藥局,121.5149795,25.11262197,臺北市北投區石牌路一段166巷83號,北投區,石牌路
石牌健康人生藥局,121.5183268,25.11867633,臺北市北投區石牌路二段187號,北投區,石牌路
鴻恩藥局,121.5011948,25.13015116,臺北市北投區中央南路一段129號,北投區,中央南路
昱仁藥局,121.5012179,25.13309534,臺北市北投區光明路102號2樓,北投區,光明路
關渡松藥局,121.4670676,25.12073577,臺北市北投區知行路247號,北投區,知行路
佳祈健保藥局,121.5207631,25.11046491,臺北市北投區明德路144號,北投區,明德路
天禧大藥局,121.508706,25.11520921,臺北市北投區實踐街35號,北投區,實踐街
秝安藥局,121.5111169,25.11358584,臺北市北投區石牌路一段69之1號(實際使用:1樓),北投區,石牌路
萬信藥局,121.4671918,25.12214405,臺北市北投區知行路305號,北投區,知行路
北投春天藥局,121.5011257,25.13134486,臺北市北投區中央南路一段76號,北投區,中央南路
致遠春天藥局,121.5148807,25.11050793,臺北市北投區致遠一路一段132號1、2樓,北投區,致遠一路
尊賢藥局,121.5080306,25.11550738,臺北市北投區尊賢街212號,北投區,尊賢街
致遠盛康藥局,121.5127873,25.11729753,臺北市北投區致遠二路141號,北投區,致遠二路
漢藥局,121.5079644,25.11853701,臺北市北投區吉利街146號,北投區,吉利街
振生大藥局,121.4847363,25.13784921,臺北市北投區中央北路三段61號,北投區,中央北路
怡人藥局,121.5169895,25.11108957,臺北市北投區自強街168號,北投區,自強街
全家藥?藥局,121.5026935,25.13508442,臺北市北投區光明路166之2號,北投區,光明路
吉利春天生活藥局,121.5068156,25.11850949,臺北市北投區吉利街120號,北投區,吉利街
生活藥局,121.5037609,25.1361901,臺北市北投區光明路213號,北投區,光明路
理得藥局,121.5131036,25.11425877,臺北市北投區石牌路一段150號,北投區,石牌路
天富大藥局,121.51802,25.11848191,臺北市北投區石牌路二段171號(實際使用:1樓),北投區,石牌路
天康大藥局,121.5014269,25.1319197,臺北市北投區中央南路一段57號,北投區,中央南路
良哲藥局,121.5208838,25.11128744,臺北市北投區明德路157之4號(實際使用:1樓),北投區,明德路
躍獅光明藥局,121.4998143,25.13286247,臺北市北投區光明路51號(實際使用:1樓)及53號(實際使用:1樓),北投區,光明路
永欣中西藥局,121.4947023,25.1451972,臺北市北投區中和街501號,北投區,中和街
陳藥師藥局,121.4996601,25.13131936,臺北市北投區光明路2巷13之2號(實際使用:1樓),北投區,光明路
石牌藥局,121.5105831,25.11329731,臺北市北投區石牌路一段４９號,北投區,石牌路
進春藥局,121.5206425,25.11086327,臺北市北投區明德路１５１號,北投區,明德路
石牌大眾藥局,121.5143913,25.11093276,臺北市北投區致遠一路二段７號,北投區,致遠一路
正一藥局,121.522281,25.11458373,臺北市北投區明德路２６９－２號,北投區,明德路
德昇藥局,121.5169575,25.11603898,臺北市北投區裕民二路２０號,北投區,裕民二路
福德大藥局,121.4960584,25.13644407,臺北市北投區中央北路二段１９號,北投區,中央北路
新祥藥局,121.4668199,25.11935203,臺北市北投區知行路２０８號之１,北投區,知行路
啟春藥局,121.5017015,25.12529909,臺北市北投區崇仁路一段１０２號１樓,北投區,崇仁路
東陽西藥局,121.501323,25.12845753,臺北市北投區中央南路一段２０３號,北投區,中央南路
世全藥局,121.4672332,25.12134174,臺北市北投區知行路２7３號,北投區,知行路
名山藥局,121.5199112,25.11230786,臺北市北投區東陽街４７５號１樓,北投區,東陽街
正仁藥局,121.5194585,25.11123428,臺北市北投區建民路１６１之９號,北投區,建民路
芳茂藥局,121.5940049,25.08313056,臺北市內湖區成功路四段151號,內湖區,成功路
葛蘭素藥局,121.5808209,25.08452389,臺北市內湖區內湖路二段１０３巷１２８號１樓,內湖區,內湖路
泰成藥局,121.5898508,25.08685341,臺北市內湖區內湖路三段１３５號１樓,內湖區,內湖路
富盛藥局,121.5926347,25.08037514,臺北市內湖區成功路四段６１巷２５弄１２號１樓,內湖區,成功路
永安藥局,121.5851909,25.07722798,臺北市內湖區文德路210巷30弄48號,內湖區,文德路
明湖藥局,121.6124682,25.06970472,臺北市內湖區東湖路７巷２７號１樓,內湖區,東湖路
清白藥局,121.6156741,25.06827722,臺北市內湖區東湖路108號,內湖區,東湖路
正心藥局,121.5726944,25.08154382,臺北市內湖區麗山街３６８號１樓,內湖區,麗山街
宏光藥局,121.5908548,25.06737828,臺北市內湖區成功路二段２２１號１樓,內湖區,成功路
麗安藥局,121.5746259,25.08328294,臺北市內湖區港華街８１號１樓,內湖區,港華街
安康藥局,121.6157878,25.06785039,臺北市內湖區安康路482號,內湖區,安康路
至康藥局,121.5785019,25.07924588,臺北市內湖區內湖路一段737巷19弄1號,內湖區,內湖路
文新藥局,121.5598966,25.08544333,臺北市內湖區文湖街７之５號１樓,內湖區,文湖街
盧狄聯合藥局,121.6128744,25.0713315,臺北市內湖區康寧路三段一八九巷五十七號,內湖區,康寧路
康信藥局,121.606229,25.0720308,臺北市內湖區民權東路六段296巷29號,內湖區,民權東路
康健藥局,121.6188594,25.07014656,臺北市內湖區康樂街80號,內湖區,康樂街
匯安藥局,121.5774205,25.07963704,臺北市內湖區內湖路1段703之1號,內湖區,內湖路
富康東湖藥局,121.6170025,25.06987934,臺北市內湖區東湖路119巷49弄16號,內湖區,東湖路
高昱藥局,121.5786133,25.07236251,臺北市內湖區陽光街321巷26號2樓之15,內湖區,陽光街
樂活藥師藥局,121.590978,25.08230202,臺北市內湖區內湖路2段368號,內湖區,內湖路
樂康藥妝藥局,121.584052,25.07870436,臺北市內湖區文德路117號,內湖區,文德路
思恩藥局,121.5932258,25.0812065,臺北市內湖區成功路4段61巷26號,內湖區,成功路
早安元氣藥局,121.5920845,25.08166562,臺北市內湖區成功路4段53號1樓,內湖區,成功路
壹零捌藥局,121.5996376,25.08487859,臺北市內湖區成功路4段344號,內湖區,成功路
瑞光藥局,121.5762695,25.07524933,臺北市內湖區瑞光路212號,內湖區,瑞光路
昇龍藥局,121.6173658,25.06810024,臺北市內湖區東湖路151號,內湖區,東湖路
桔子藥局,121.5916673,25.08318532,臺北市內湖區內湖路二段333號,內湖區,內湖路
晟安藥局,121.590203,25.08593489,臺北市內湖區金龍路135號,內湖區,金龍路
宜昇優良藥局,121.6120385,25.07155477,臺北市內湖區康寧路三段165巷23弄5號,內湖區,康寧路
躍獅寶湖藥局,121.5928164,25.07009764,臺北市內湖區民權東路六段123巷28號,內湖區,民權東路
傑昇藥局,121.5890454,25.08180262,臺北市內湖區內湖路二段227號,內湖區,內湖路
新安健保藥局,121.5796932,25.05465735,臺北市內湖區新明路402號,內湖區,新明路
仕德安藥局,121.5846466,25.05711399,臺北市內湖區新明路210號,內湖區,新明路
躍獅東湖藥局,121.6046726,25.0736172,臺北市內湖區金湖路378號,內湖區,金湖路
樂齡藥師藥局,121.5909003,25.08640847,臺北市內湖區內湖路三段103號,內湖區,內湖路
喜越藥局,121.5673304,25.08376702,臺北市內湖區內湖路一段285巷59弄7號,內湖區,內湖路
江南大藥局,121.5791484,25.07656028,臺北市內湖區文德路22巷9弄56號,內湖區,文德路
躍獅大湖藥局,121.5989758,25.08453684,臺北市內湖區成功路四段329號,內湖區,成功路
澴山藥局,121.5653911,25.08288233,臺北市內湖區環山路一段四號,內湖區,環山路
瑞暉藥局,121.5836889,25.07870207,臺北市內湖區文德路105號,內湖區,文德路
躍獅康成藥局,121.5927777,25.08139792,臺北市內湖區成功路四段61巷11號,內湖區,成功路
躍獅麗湖藥局,121.5705671,25.08188461,臺北市內湖區內湖路一段401之1號,內湖區,內湖路
晶龍藥局,121.5961049,25.08456557,臺北市內湖區成功路四段218號,內湖區,成功路
佑全內湖康寧藥局,121.6077642,25.0726415,臺北市內湖區康寧路三段39號、39號2樓、41號、43號,內湖區,康寧路
松達藥師藥局,121.5674314,25.08444205,臺北市內湖區內湖路一段285巷65弄9號,內湖區,內湖路
安安藥局,121.5917737,25.08028857,臺北市內湖區康寧路一段42號,內湖區,康寧路
杏一港墘藥局,121.5780845,25.08077657,臺北市內湖區港墘路83號,內湖區,港墘路
原大藥局,121.5788115,25.08057767,臺北市內湖區內湖路一段737巷50弄5號,內湖區,內湖路
和康健保藥局,121.5817806,25.07720303,臺北市內湖區文德路66巷41號,內湖區,文德路
葫光藥局,121.6089927,25.07167879,臺北市內湖區康寧路三段54巷6號,內湖區,康寧路
耀元藥局,121.6192412,25.07262737,臺北市內湖區康樂街150號,內湖區,康樂街
西湖藥局,121.5692618,25.0822,臺北市內湖區內湖路一段355號,內湖區,內湖路
維安藥局,121.5906365,25.08143424,臺北市內湖區成功路三段174巷23號,內湖區,成功路
加一藥師藥局,121.5907588,25.07804238,臺北市內湖區星雲街24號,內湖區,星雲街
瑞陽藥局,121.5828919,25.0783117,臺北市內湖區文德路102號,內湖區,文德路
富康文德藥局,121.5800004,25.07659464,臺北市內湖區文德路22巷27弄4號,內湖區,文德路
內湖藥局,121.5934021,25.07948429,臺北市內湖區康寧路一段116號,內湖區,康寧路
赫得藥局,121.6178378,25.06975629,臺北市內湖區康樂街七十二巷十七弄四號一樓,內湖區,康樂街
富山藥局,121.5728334,25.08168028,臺北市內湖區麗山街３６４巷２號１樓,內湖區,麗山街
旭志藥局,121.5910505,25.08634433,臺北市內湖區內湖路三段９７號１樓,內湖區,內湖路
順欣藥局,121.592713,25.07908205,臺北市內湖區星雲街73號,內湖區,星雲街
杏佳藥局,121.5919957,25.08033035,臺北市內湖區康寧路一段51號,內湖區,康寧路
展恩藥局,121.5876984,25.068664,臺北市內湖區民權東路六段136巷4號,內湖區,民權東路
大內湖藥局,121.5909927,25.08107158,臺北市內湖區成功路四段12號,內湖區,成功路
裕成藥局,121.5834483,25.04433432,臺北市南港區玉成街１６６巷１３號,南港區,玉成街
新錦安藥局,121.5922164,25.05429245,臺北市南港區南港路三段３４號,南港區,南港路
仁泰藥局,121.5840858,25.04510802,臺北市南港區同德路２８號,南港區,同德路
加欣藥局,121.6053979,25.05425119,臺北市南港區南港路二段26號,南港區,南港路
祥安藥局,121.5831681,25.04328798,臺北市南港區中坡南路25號,南港區,中坡南路
德鴻藥局,121.5841124,25.04465957,臺北市南港區玉成街１６８號１樓,南港區,玉成街
上丞藥師藥局,121.5858942,25.04573965,臺北市南港區成福路10號1樓,南港區,成福路
新東發藥局,121.5882673,25.04091936,臺北市南港區成福路１９８號,南港區,成福路
富康活力藥局,121.6165119,25.05180935,臺北市南港區研究院路一段101巷8號,南港區,研究院路
亞博藥師藥局,121.6060585,25.05544707,臺北市南港區興華路81號,南港區,興華路
佳龍藥局,121.6152004,25.04539707,臺北市南港區研究院路2段80號,南港區,研究院路
湳港藥局,121.6166965,25.05175363,臺北市南港區研究院路1段101巷12號,南港區,研究院路
進慧藥局,121.6157001,25.05030868,臺北市南港區研究院路一段163號,南港區,研究院路
儀安健保藥局,121.5852902,25.04569787,臺北市南港區同德路74號,南港區,同德路
泓安藥局,121.6061283,25.05516682,臺北市南港區興華路75號,南港區,興華路
健涵藥局,121.6205027,25.03985358,臺北市南港區舊莊街一段147號,南港區,舊莊街
南港藥局,121.6118829,25.0553586,臺北市南港區南港路一段166號,南港區,南港路
順翔藥局,121.616894,25.03784937,臺北市南港區研究院路二段170號,南港區,研究院路
景星藥局,121.5923991,25.05434158,臺北市南港區南港路三段26號,南港區,南港路
成恩藥局,121.586734,25.04472686,臺北市南港區成福路23號,南港區,成福路
小藥師健保藥局,121.5879838,25.03948317,臺北市南港區福德街320之1號,南港區,福德街
心亮藥局,121.581777,25.04692213,臺北市南港區玉成街66之7號,南港區,玉成街
杏安藥局,121.5937912,25.04969297,臺北市南港區昆陽街140巷16號,南港區,昆陽街
勝安藥局,121.6211172,25.0394908,臺北市南港區舊莊街一段165號,南港區,舊莊街
成福大藥局,121.58587,25.04577656,臺北市南港區成福路8號,南港區,成福路
心心藥局,121.615133,25.04551573,臺北市南港區研究院路二段76號,南港區,研究院路
開欣藥局,121.6048022,25.05470165,臺北市南港區南港路二段38巷6之1號,南港區,南港路
躍獅忠孝藥局,121.585978,25.04561188,臺北市南港區成福路16號,南港區,成福路
四葉藥局,121.6158362,25.05512102,臺北市南港區南港路一段65號,南港區,南港路
旭村藥局,121.6055424,25.05660779,臺北市南港區興華路１１２號,南港區,興華路
志銘藥局,121.6171386,25.05199936,臺北市南港區研究院路一段１０１巷１１號,南港區,研究院路
麗康藥局,121.5847535,25.04564134,臺北市南港區同德路51號,南港區,同德路
親親藥局,121.583236,25.04478808,臺北市南港區玉成街140巷7號1樓,南港區,玉成街
健園藥局,121.6165702,25.05401416,臺北市南港區研究院路一段19號1樓,南港區,研究院路
可可藥局,121.6152335,25.04688584,臺北市南港區研究院路二段36號,南港區,研究院路
圓鼎藥局,121.5405585,24.99161937,臺北市文山區羅斯福路六段407號2樓之1,文山區,羅斯福路
裕康藥局,121.546206,24.986678,臺北市文山區木柵路一段１２號,文山區,木柵路
景美藥局,121.541192,24.99033056,臺北市文山區景文街１２５號,文山區,景文街
