機構名稱,Longitude,Latitude,Address,Area,St
全銨藥局,121.5558215,24.98034464,臺北市文山區木新路三段３４９號１樓,文山區,木新路
錫東藥局,121.5372983,25.00075085,臺北市文山區萬隆街５６號,文山區,萬隆街
日信專業藥局,121.5625274,24.98906005,臺北市文山區木柵路二段一三九號一樓,文山區,木柵路
逸仙藥師藥局,121.5524418,25.00148169,臺北市文山區興隆路二段２１８之１號１樓,文山區,興隆路
康宜庭生活藥局,121.5613254,24.98514197,臺北市文山區興隆路四段64號,文山區,興隆路
博揚藥局,121.5444236,24.99280187,臺北市文山區景興路一八一號,文山區,景興路
東京晟藥局,121.5587023,25.00683841,臺北市文山區辛亥路四段97號,文山區,辛亥路
仙瑩藥局,121.547879,24.99693269,臺北市文山區景華街166號,文山區,景華街
舒博威藥局,121.5470042,24.99951715,臺北市文山區興隆路二段九十五巷三號,文山區,興隆路
佳醫景美藥局,121.5398439,24.991001,臺北市文山區羅斯福路六段二九0號,文山區,羅斯福路
慶豐好藥局,121.5615649,24.9853556,臺北市文山區興隆路四段135號1樓,文山區,興隆路
華君藥局,121.5477628,24.99955373,臺北市文山區興隆路二段60號,文山區,興隆路
永原大藥局,121.5584276,24.9983535,臺北市文山區興隆路三段166號,文山區,興隆路
皇興藥師藥局,121.5620665,24.98900741,臺北市文山區木柵路2段121號,文山區,木柵路
宇康藥局,121.5382936,25.00202751,臺北市文山區羅斯福路五段218巷7號,文山區,羅斯福路
康宜庭景文藥局,121.541346,24.99093024,臺北市文山區景文街97號,文山區,景文街
人人健保藥局,121.568694,24.98785759,臺北市文山區保儀路39號,文山區,保儀路
杏隆藥局,121.5395045,25.00115071,臺北市文山區羅斯福路5段261號,文山區,羅斯福路
永源大藥局,121.5587971,24.99312436,臺北市文山區興隆路3段302號,文山區,興隆路
康宜庭萬隆藥局,121.5384483,25.00322085,臺北市文山區羅斯福路五段202號,文山區,羅斯福路
美迦藥局,121.5687107,24.98814733,臺北市文山區保儀路23號,文山區,保儀路
振大藥局,121.5696695,24.98682893,臺北市文山區永安街22巷16號,文山區,永安街
躍獅奕新藥局,121.5660167,24.98291979,臺北市文山區木新路2段275號,文山區,木新路
宜康藥局,121.5686398,24.98871911,臺北市文山區保儀路7號,文山區,保儀路
欣安景美藥局,121.541429,24.99125915,臺北市文山區景文街77號,文山區,景文街
北一藥師藥局,121.5641641,24.98235975,臺北市文山區木新路三段47號,文山區,木新路
萬隆大藥局,121.5379591,25.0020275,臺北市文山區羅斯福路五段218巷15號,文山區,羅斯福路
杏一萬安藥局,121.5706398,25.00139022,臺北市文山區萬安街15號,文山區,萬安街
躍獅永健藥局,121.5509918,24.98776692,臺北市文山區木柵路一段177號,文山區,木柵路
健康人生藥局,121.5572612,24.99932132,臺北市文山區興隆路三段106號,文山區,興隆路
木新健康人生藥局,121.5598336,24.98139664,臺北市文山區木新路三段203號,文山區,木新路
大樹文山藥局,121.5549786,25.00087761,臺北市文山區興隆路三段13號(1、2、3樓),文山區,興隆路
景華盛康藥局,121.5450412,24.99524255,臺北市文山區景華街69號,文山區,景華街
杏一木柵藥局,121.5673562,24.9886051,臺北市文山區木柵路三段98號,文山區,木柵路
123健康藥局,121.5528932,25.00020844,臺北市文山區興隆路2段220巷31弄26號,文山區,興隆路
光明大藥局,121.5606765,24.98425916,臺北市文山區忠順街一段66號,文山區,忠順街
福興藥局,121.5504559,25.00345137,臺北市文山區福興路56號,文山區,福興路
路加健康藥局,121.5521798,25.00021633,臺北市文山區興隆路二段220巷39號,文山區,興隆路
健安藥局,121.5446632,24.99346395,臺北市文山區景興路165號,文山區,景興路
逸全生活藥局,121.5387563,25.00197268,臺北市文山區羅斯福路五段222號,文山區,羅斯福路
躍獅新芳藥局,121.5548717,25.00061694,臺北市文山區興隆路三段16號(實際營業地址:1樓),文山區,興隆路
綠杏萬芳藥局,121.5583303,25.00030628,臺北市文山區興隆路三段111號,文山區,興隆路
躍獅景新藥局,121.5396453,24.99978391,臺北市文山區羅斯福路6段30號,文山區,羅斯福路
大愛幸福藥局,121.5675237,24.98344322,臺北市文山區木新路二段221號,文山區,木新路
躍獅木柵藥局,121.5694887,24.98756013,臺北市文山區指南路一段28號,文山區,指南路
康宜庭興隆藥局,121.5590155,24.99778685,臺北市文山區興隆路三段200號,文山區,興隆路
專品政大藥局,121.5742203,24.98783831,臺北市文山區指南路二段8號,文山區,指南路
光點景興藥局,121.544818,24.99496272,臺北市文山區景興路109號,文山區,景興路
大樹木柵藥局,121.5675973,24.98865634,臺北市文山區木柵路三段108號、110號(實際營業地址:1樓、2樓),文山區,木柵路
大樹景美藥局,121.5404289,24.99243958,臺北市文山區羅斯福路六段234之1號,文山區,羅斯福路
建興藥局,121.5609698,24.98888882,臺北市文山區木柵路二段８１號１樓,文山區,木柵路
健群藥局,121.5448382,24.99717182,臺北市文山區景興路４１號,文山區,景興路
瑞安藥局,121.539341,24.99511967,臺北市文山區溪口街６９之１號１樓,文山區,溪口街
新陽藥局,121.5550116,24.9875579,臺北市文山區光輝路１６號,文山區,光輝路
慈安藥局,121.5593449,24.98324528,臺北市文山區忠順街一段２６巷１８號,文山區,忠順街
三和藥局,121.5398145,24.99367921,臺北市文山區景福街２５５號,文山區,景福街
京城藥局,121.5599613,24.98416064,臺北市文山區忠順街一段４２號１樓,文山區,忠順街
永明大藥局,121.544901,24.99874928,臺北市文山區興隆路一段二九七號一樓,文山區,興隆路
銘依藥局,121.5534302,25.00166147,臺北市文山區興隆路二段301巷4-1號,文山區,興隆路
巧康藥局,121.5644405,24.98282703,臺北市文山區木新路3段262、264號,文山區,木新路
安誠藥局,121.5468254,24.99561119,臺北市文山區景華街124之1號,文山區,景華街
健康家藥局,121.5480562,25.00011325,臺北市文山區興隆路二段133號,文山區,興隆路